{"schema_version":2,"id":"frecon.pv100-pv200.research","category":"inverter","manufacturer":"FRECON","family":"PV100/PV200 solar pump drive","models":["PV100","PV200"],"firmware_ranges":["manufacturer confirmation required"],"simulated":false,"provenance":{"source":"user-supplied-manual","document_id":"FRECON-PV100-PV200-USER-MANUAL","retrieved_on":"2026-10-17","verified_by":"documentation-review-only"},"transport":{"interface":"rs485","baud_rates":[1200,2400,4800,9600,19200,38400],"data_formats":["8N1","8E1","8O1"],"listen_only_default":true},"capabilities":{"identify":"researchTarget","read_live":"researchTarget","read_config":"researchTarget","write_parameter":"researchTarget","calibrate":"researchTarget"},"allowed_read_frames":[],"allowed_modbus_read_ranges":[],"telemetry_map":[],"alarm_dictionary":{},"parameters":[],"topology":{"application":"solar-pump-drive"},"inverter_link":{"protocol":"Modbus RTU","register_map_status":"required-from-manufacturer"},"test_vectors":[],"connection_checklist":[{"en":"Confirm the RS485 settings shown on the drive.","ar":"تحقق من إعدادات RS485 الظاهرة على المشغل."},{"en":"Register map required from manufacturer.","ar":"يلزم الحصول على خريطة السجلات من الشركة المصنعة."}]}
